Patch v1: https://reviews.apache.org/r/28422/



{color:red}Overall{color}: -1 at least one tests failed

Here are the results of testing the latest attachment:
https://issues.apache.org/jira/secure/attachment/12683447/HIVE-8855.1-spark.patch

{color:red}ERROR:{color} -1 due to 3 failed/errored test(s), 7181 tests executed
*Failed tests:*
{noformat}
org.apache.hadoop.hive.cli.TestCliDriver.testCliDriver_sample_islocalmode_hook
org.apache.hadoop.hive.cli.TestSparkCliDriver.testCliDriver_optimize_nullscan
org.apache.hive.hcatalog.streaming.TestStreaming.testEndpointConnection
{noformat}

Test results: http://ec2-174-129-184-35.compute-1.amazonaws.com/jenkins/job/PreCommit-HIVE-SPARK-Build/418/testReport
Console output: http://ec2-174-129-184-35.compute-1.amazonaws.com/jenkins/job/PreCommit-HIVE-SPARK-Build/418/console
Test logs: http://ec2-50-18-27-0.us-west-1.compute.amazonaws.com/logs/PreCommit-HIVE-SPARK-Build-418/

Messages:
{noformat}
Executing org.apache.hive.ptest.execution.PrepPhase
Executing org.apache.hive.ptest.execution.ExecutionPhase
Executing org.apache.hive.ptest.execution.ReportingPhase
Tests exited with: TestsFailedException: 3 tests failed
{noformat}

This message is automatically generated.

ATTACHMENT ID: 12683447 - PreCommit-HIVE-SPARK-Build

Attached v2 that addressed Xuefu's review comment.

+1 pending on test.



{color:red}Overall{color}: -1 at least one tests failed

Here are the results of testing the latest attachment:
https://issues.apache.org/jira/secure/attachment/12683471/HIVE-8855.2-spark.patch

{color:red}ERROR:{color} -1 due to 3 failed/errored test(s), 7181 tests executed
*Failed tests:*
{noformat}
org.apache.hadoop.hive.cli.TestCliDriver.testCliDriver_sample_islocalmode_hook
org.apache.hadoop.hive.cli.TestMiniTezCliDriver.testCliDriver_optimize_nullscan
org.apache.hadoop.hive.cli.TestSparkCliDriver.testCliDriver_optimize_nullscan
{noformat}

Test results: http://ec2-174-129-184-35.compute-1.amazonaws.com/jenkins/job/PreCommit-HIVE-SPARK-Build/422/testReport
Console output: http://ec2-174-129-184-35.compute-1.amazonaws.com/jenkins/job/PreCommit-HIVE-SPARK-Build/422/console
Test logs: http://ec2-50-18-27-0.us-west-1.compute.amazonaws.com/logs/PreCommit-HIVE-SPARK-Build-422/

Messages:
{noformat}
Executing org.apache.hive.ptest.execution.PrepPhase
Executing org.apache.hive.ptest.execution.ExecutionPhase
Executing org.apache.hive.ptest.execution.ReportingPhase
Tests exited with: TestsFailedException: 3 tests failed
{noformat}

This message is automatically generated.

ATTACHMENT ID: 12683471 - PreCommit-HIVE-SPARK-Build

HI,i built a hive-on-spark package (the hive src code with spark branch get from https://github.com/apache/hive.git )and built a spark (master branch get from https://github.com/apache/spark.git ),my assembly jar is spark-assembly-1.2.0-SNAPSHOT-hadoop2.4.0.jar,and configure this assembly jar path in hive-env.sh (export HIVE_AUX_JARS_PATH),and start metastore server ,then i run this comand in hive shell:
set hive.execution.engine=spark;
set spark.master=spark://xxx.xxx.x.x:7077;
set spark.eventLog.enabled=true; 
set spark.executor.memory=1024m;
set spark.serializer=org.apache.spark.serializer.KryoSerializer;
then start a query ,but it seems it can't jump to spark engine,it still give me some error like :
ication_time: 1416935573226 access_time: 0 block_replication: 0 blocksize: 0 fileId: 31127 childrenNum: 0 }}
14/11/26 01:12:53 [main]: INFO session.SessionState: No Tez session required at this point. hive.execution.engine=mr.
i think it still use mr for query,i don't konw why ,and in the spark webui,i can't found any info during query in hive.can u tell me why?


Hi, [~jxiang], I hit this exception with the path.
{noformat}
onReceive(314)) - Received hello from akka.tcp://79ec2601-f6e9-40de-b7bf-6b5760126a28@192.168.150.114:33902/user/RemoteDriver
2014-11-25 17:40:01,502 ERROR [94df45b9-4960-487f-ab39-6b659fc6b899-akka.actor.default-dispatcher-4]: remote.EndpointWriter (Slf4jLogger.scala:apply$mcV$sp(66)) - Transient association error (association remains live)
java.io.NotSerializableException: java.lang.Thread
        at java.io.ObjectOutputStream.writeObject0(ObjectOutputStream.java:1183)
        at java.io.ObjectOutputStream.defaultWriteFields(ObjectOutputStream.java:1547)
        at java.io.ObjectOutputStream.writeSerialData(ObjectOutputStream.java:1508)
        at java.io.ObjectOutputStream.writeOrdinaryObject(ObjectOutputStream.java:1431)
        at java.io.ObjectOutputStream.writeObject0(ObjectOutputStream.java:1177)
        at java.io.ObjectOutputStream.defaultWriteFields(ObjectOutputStream.java:1547)
        at java.io.ObjectOutputStream.writeSerialData(ObjectOutputStream.java:1508)
        at java.io.ObjectOutputStream.writeOrdinaryObject(ObjectOutputStream.java:1431)
        at java.io.ObjectOutputStream.writeObject0(ObjectOutputStream.java:1177)
        at java.io.ObjectOutputStream.defaultWriteFields(ObjectOutputStream.java:1547)
        at java.io.ObjectOutputStream.writeSerialData(ObjectOutputStream.java:1508)
        at java.io.ObjectOutputStream.writeOrdinaryObject(ObjectOutputStream.java:1431)
        at java.io.ObjectOutputStream.writeObject0(ObjectOutputStream.java:1177)
        at java.io.ObjectOutputStream.writeObject(ObjectOutputStream.java:347)
        at akka.serialization.JavaSerializer$$anonfun$toBinary$1.apply$mcV$sp(Serializer.scala:129)
        at akka.serialization.JavaSerializer$$anonfun$toBinary$1.apply(Serializer.scala:129)
        at akka.serialization.JavaSerializer$$anonfun$toBinary$1.apply(Serializer.scala:129)
        at scala.util.DynamicVariable.withValue(DynamicVariable.scala:57)
        at akka.serialization.JavaSerializer.toBinary(Serializer.scala:129)
        at akka.remote.serialization.MessageContainerSerializer.serializeSelection(MessageContainerSerializer.scala:36)
        at akka.remote.serialization.MessageContainerSerializer.toBinary(MessageContainerSerializer.scala:25)
        at akka.remote.MessageSerializer$.serialize(MessageSerializer.scala:36)
        at akka.remote.EndpointWriter$$anonfun$serializeMessage$1.apply(Endpoint.scala:845)
        at akka.remote.EndpointWriter$$anonfun$serializeMessage$1.apply(Endpoint.scala:845)
        at scala.util.DynamicVariable.withValue(DynamicVariable.scala:57)
        at akka.remote.EndpointWriter.serializeMessage(Endpoint.scala:844)
        at akka.remote.EndpointWriter.writeSend(Endpoint.scala:747)
        at akka.remote.EndpointWriter$$anonfun$2.applyOrElse(Endpoint.scala:722)
        at akka.actor.Actor$class.aroundReceive(Actor.scala:465)
        at akka.remote.EndpointActor.aroundReceive(Endpoint.scala:415)
        at akka.actor.ActorCell.receiveMessage(ActorCell.scala:516)
        at akka.actor.ActorCell.invoke(ActorCell.scala:487)
        at akka.dispatch.Mailbox.processMailbox(Mailbox.scala:238)
        at akka.dispatch.Mailbox.run(Mailbox.scala:220)
        at akka.dispatch.ForkJoinExecutorConfigurator$AkkaForkJoinTask.exec(AbstractDispatcher.scala:393)
        at scala.concurrent.forkjoin.ForkJoinTask.doExec(ForkJoinTask.java:260)
        at scala.concurrent.forkjoin.ForkJoinPool$WorkQueue.runTask(ForkJoinPool.java:1339)
        at scala.concurrent.forkjoin.ForkJoinPool.runWorker(ForkJoinPool.java:1979)
        at scala.concurrent.forkjoin.ForkJoinWorkerThread.run(ForkJoinWorkerThread.java:107)

{noformat}
It should because SparkClientImpl::getExecutorCount submit inner class job which make akka serializer SparkClientImpl instance with Java Serializer, I think you may move the logic of getExecutorCount to RemoteSparkClient.

Thanks for catching this, Chengxiang.

Alternatively, and probably better, we can define staticically a job class in SparkClientImpl, similar to AddJarJob. This makes the code consistent.


Patch #3 refactored a little bit of the problematic code. Also removed the changes made to .gitignore as it's not relevant.



{color:red}Overall{color}: -1 at least one tests failed

Here are the results of testing the latest attachment:
https://issues.apache.org/jira/secure/attachment/12683532/HIVE-8855.3-spark.patch

{color:red}ERROR:{color} -1 due to 6 failed/errored test(s), 7177 tests executed
*Failed tests:*
{noformat}
org.apache.hadoop.hive.cli.TestCliDriver.testCliDriver_sample_islocalmode_hook
org.apache.hadoop.hive.cli.TestCliDriver.testCliDriver_update_where_partitioned
org.apache.hadoop.hive.cli.TestSparkCliDriver.testCliDriver_auto_join22
org.apache.hadoop.hive.cli.TestSparkCliDriver.testCliDriver_bucketmapjoin7
org.apache.hadoop.hive.cli.TestSparkCliDriver.testCliDriver_optimize_nullscan
org.apache.hive.hcatalog.streaming.TestStreaming.testTransactionBatchEmptyCommit
{noformat}

Test results: http://ec2-174-129-184-35.compute-1.amazonaws.com/jenkins/job/PreCommit-HIVE-SPARK-Build/428/testReport
Console output: http://ec2-174-129-184-35.compute-1.amazonaws.com/jenkins/job/PreCommit-HIVE-SPARK-Build/428/console
Test logs: http://ec2-50-18-27-0.us-west-1.compute.amazonaws.com/logs/PreCommit-HIVE-SPARK-Build-428/

Messages:
{noformat}
Executing org.apache.hive.ptest.execution.PrepPhase
Executing org.apache.hive.ptest.execution.ExecutionPhase
Executing org.apache.hive.ptest.execution.ReportingPhase
Tests exited with: TestsFailedException: 6 tests failed
{noformat}

This message is automatically generated.

ATTACHMENT ID: 12683532 - PreCommit-HIVE-SPARK-Build

Good catch. Thanks!

The spark tests are ok locally. Attached patch v3 again.



{color:red}Overall{color}: -1 at least one tests failed

Here are the results of testing the latest attachment:
https://issues.apache.org/jira/secure/attachment/12683620/HIVE-8855.3-spark.patch

{color:red}ERROR:{color} -1 due to 4 failed/errored test(s), 7178 tests executed
*Failed tests:*
{noformat}
org.apache.hadoop.hive.cli.TestCliDriver.testCliDriver_sample_islocalmode_hook
org.apache.hadoop.hive.cli.TestMiniTezCliDriver.testCliDriver_optimize_nullscan
org.apache.hadoop.hive.cli.TestSparkCliDriver.testCliDriver_bucketmapjoin7
org.apache.hadoop.hive.cli.TestSparkCliDriver.testCliDriver_optimize_nullscan
{noformat}

Test results: http://ec2-174-129-184-35.compute-1.amazonaws.com/jenkins/job/PreCommit-HIVE-SPARK-Build/431/testReport
Console output: http://ec2-174-129-184-35.compute-1.amazonaws.com/jenkins/job/PreCommit-HIVE-SPARK-Build/431/console
Test logs: http://ec2-50-18-27-0.us-west-1.compute.amazonaws.com/logs/PreCommit-HIVE-SPARK-Build-431/

Messages:
{noformat}
Executing org.apache.hive.ptest.execution.PrepPhase
Executing org.apache.hive.ptest.execution.ExecutionPhase
Executing org.apache.hive.ptest.execution.ReportingPhase
Tests exited with: TestsFailedException: 4 tests failed
{noformat}

This message is automatically generated.

ATTACHMENT ID: 12683620 - PreCommit-HIVE-SPARK-Build

The {{optimize_nullscan}} test seems to be very flaky and if {{bucketmapjoin7.q}} continues to fail we'll fix in a followup since this is blocking HIVE-8836.

Thank you Jimmy! I have committed this to spark.

[~yuemeng], Thanks for your interest in trying Hive on Spark. However, the JIRA isn't the right forum to discuss about technical difficulties that you might encounter, which are irrelevant to the issue the JIRA is about. I encourage you to use dev@hive.apache.org to raise your questions or ask for help. I don't know why you are having such a problem, but I guess you can use command "set hive.execution.engine;" to confirm that the right engine is set.

hi,Xuefu.Forgive me，This is my first time using jira, do not know the right way, I will not do this anymore, I will choose the right way to ask for help or to contribute

